{
  "chapter_id": "018f0000-0000-7001-8000-000000000301",
  "completeness": "complete",
  "correlation_id": "018f0000-0000-7001-8000-000000000c01",
  "project_scope": {
    "owner_user_id": "018f0000-0000-7001-8000-000000000001",
    "project_id": "018f0000-0000-7001-8000-000000000201"
  },
  "proposals": [],
  "schema_id": "storyos.query.chapter-open-proposals.response.v1"
}
